Name,Year,Genre,Perspective,Console,Moby Score,Critics,Publishers,Developers,Multiplayer,Offline Players,Gameplay
Avalon Hill's Diplomacy,1999,Strategy,Board game,Windows,4.8,52% (12),Meyer Glass Interactive Ltd.,Meyer Glass Interactive Ltd.,0.0,1.0,Licensed
Terrorist Takedown: Payback,2005,Action,1st-person,Windows,4.8,35% (7),CITY interactive Sp. z o.o.,CITY interactive Sp. z o.o.,0.0,1.0,"Rail shooter, Shooter"
Naughty Bear,2010,Action,3rd-person (Other),Xbox 360,4.8,45% (58),505 Games S.R.L.,505 Games S.R.L.,0.0,1.0,
Justice League Heroes,2006,Action,3rd-person (Other),Nintendo DS,4.8,38% (12),Sensory Sweep Studios,Sensory Sweep Studios,0.0,1.0,Sci-fi / futuristic
F16 Fighting Falcon,1984,Action,1st-person,MSX,4.8,29% (7),"ASCII Corporation, SEGA Enterprises Ltd., SEGA of America, Inc., Tec Toy Indústria de Brinquedos S.A.",ASCII Corporation,0.0,1.0,"Flight / aviation, Vehicular combat"
The Games '92 - España,1992,Sports,Managerial / business simulation,DOS,4.8,40% (8),"Ocean Software Ltd., Mirage Software",Ocean Software Ltd.,0.0,1.0,Olympiad / mixed sports
Deca Sports: Freedom,2010,Sports,3rd-person (Other),Xbox 360,4.8,22% (5),"Hudson Soft Company, Ltd.","Hudson Soft Company, Ltd.",0.0,1.0,"Boxing, Snowboarding / skiing, Volleyball"
Dreams,1998,Action,3rd-person (Other),PlayStation,4.8,24% (5),Cryo Interactive Entertainment,Cryo Interactive Entertainment,0.0,1.0,
Rampage Through Time,2000,Action,Side view,PlayStation,4.8,34% (7),Avalanche Software LLC,Avalanche Software LLC,0.0,1.0,"Arcade, Fighting"
Beauty Factory,2007,Simulation,Isometric,Windows,4.8,27% (5),City Interactive S.A.,City Interactive S.A.,0.0,1.0,Managerial / business simulation
Spiritual Warfare,1992,Action,Top-down,NES,4.8,39% (6),"Wisdom Tree, Inc.","Wisdom Tree, Inc.",0.0,1.0,Religion
Balan Wonderworld,2021,Action,3rd-person (Other),Xbox One,4.8,45% (53),"Square Enix Co., Ltd., Square Enix, Inc., Square Enix Limited","Square Enix Co., Ltd.",0.0,1.0,"Puzzle elements, RPG elements"
Zoom: Paparazzi in Action,2006,Action,1st-person,Windows,4.8,35% (8),Exozet Games GmbH,Exozet Games GmbH,0.0,1.0,
Merchants of Brooklyn,2009,Action,1st-person,Windows,4.8,36% (8),Paleo Entertainment,Paleo Entertainment,0.0,1.0,Shooter
SpeedRage,1996,Racing / Driving,1st-person,DOS,4.8,37% (7),Hexerei Games,Hexerei Games,0.0,1.0,"Arcade, Shooter"
China Warrior,1987,Action,Side view,TurboGrafx-16,4.8,36% (14),"Hudson Soft Company, Ltd., NEC Technologies, Inc., Hudson Entertainment, Inc.","Hudson Soft Company, Ltd.",0.0,1.0,2D scrolling
Duel Master: Blood Valley,1987,Action,Side view,Commodore 64,4.8,44% (7),Gremlin Graphics Software Limited,Gremlin Graphics Software Limited,0.0,1.0,Fantasy
Dash Galaxy in the Alien Asylum,1990,Action,Side view,NES,4.8,28% (4),"Data East USA, Inc., Beam Software Pty., Ltd.","Data East USA, Inc.",0.0,1.0,"Arcade, Platform"
Hellfire Attack,1988,Action,Behind view,Amiga,4.8,45% (9),"Martech Games Ltd., Alternative Software Ltd.",Martech Games Ltd.,0.0,1.0,"Arcade, Shooter"
Happy Feet,2006,Action,Behind view,Windows,4.8,42% (23),"Midway Home Entertainment, Inc.","Midway Home Entertainment, Inc.",0.0,1.0,Puzzle elements
'43 - One Year After,1986,Action,Top-down,Commodore 64,4.8,26% (5),Greve Graphics,Greve Graphics,0.0,1.0,"Arcade, Shooter"
Timecop,1995,Action,Platform,SNES,4.8,33% (6),Cryo Interactive Entertainment,Cryo Interactive Entertainment,0.0,1.0,Sci-fi / futuristic
Kawasaki ATV PowerSports,2000,Racing / Driving,1st-person,Windows,4.8,32% (5),"Encore, Inc.","Encore, Inc.",0.0,1.0,Off-roading
Beyond the Law: The Third Wave,2003,Strategy,Diagonal-down,Windows,4.8,41% (15),"PAN Vision AB, NICOLAS GAMES Sp. z o.o., Magnum Games, Noviy Disk",PAN Vision AB,0.0,1.0,Real-time
Lethal Weapon,1993,Action,Side view,NES,4.8,36% (12),"Ocean Europe Limited, Ocean of America, Inc.",Ocean Europe Limited,0.0,1.0,2D scrolling
Surf Ninjas,1994,Action,Side view,DOS,4.8,22% (6),"Capstone Software, MicroValue, Ltd",Capstone Software,0.0,1.0,"Beat 'em up / brawler, Fighting, Puzzle elements"
Two Thrones,2004,Strategy,Top-down,Windows,4.8,37% (10),Paradox Entertainment AB,Paradox Entertainment AB,0.0,1.0,Real-time
Johnny Mnemonic,1995,Action,1st-person,Windows,4.8,44% (9),Sony Imagesoft,Sony Imagesoft,0.0,1.0,Full Motion Video (FMV)
Aliens: Colonial Marines,2013,Action,1st-person,Windows,4.8,42% (38),"SEGA of America, Inc.","SEGA of America, Inc.",0.0,1.0,Shooter
Aqua Teen Hunger Force: Zombie Ninja Pro-Am,2007,Action,3rd-person (Other),PlayStation 2,4.8,39% (19),"Creat Studios, Inc.","Creat Studios, Inc.",0.0,1.0,Real-time
Bullseye,1984,Simulation,3rd-person (Other),ZX Spectrum,4.8,41% (2),"Macsen Software, TV Games",Macsen Software,0.0,1.0,"Board game, Game show / trivia / quiz"
Orion: Prelude,2013,Action,1st-person,Windows,4.8,31% (6),Spiral Game Studios,Spiral Game Studios,0.0,1.0,Shooter
X-Men: Mutant Academy,2000,Action,Side view,Game Boy Color,4.8,39% (16),Crawfish Interactive Ltd.,Crawfish Interactive Ltd.,0.0,1.0,2D scrolling
High Impact Paintball,2000,Action,1st-person,Windows,4.8,28% (5),"Sunstorm Interactive, Inc.","Sunstorm Interactive, Inc.",0.0,1.0,Shooter
Tenchu: Dark Secret,2006,Action,Behind view,Nintendo DS,4.8,38% (12),"Polygon Magic, Inc.","Polygon Magic, Inc.",0.0,1.0,"Fighting, Stealth"
Alien Blast: The Encounter,2003,Action,1st-person,Windows,4.8,38% (8),"Made By KIDDIES, Inc.","Made By KIDDIES, Inc.",0.0,1.0,"Arcade, Shooter"
Hydlide,1984,Action,Top-down,PC-88,4.8,28% (8),"T&E Soft, Inc., Philips Export B.V., Toshiba-EMI Ltd.","T&E Soft, Inc.",0.0,1.0,Fixed / flip-screen
Quartet,1986,Action,Side view,Arcade,4.8,42% (7),"SEGA Enterprises Ltd., Activision, Inc., Hit Squad, The",SEGA Enterprises Ltd.,0.0,1.0,2D scrolling
Batman Returns,1993,Action,Side view,Amiga,4.8,31% (5),Dentons,Dentons,0.0,1.0,2D scrolling
Far Cry: Vengeance,2006,Action,1st-person,Wii,4.9,43% (29),Ubisoft Entertainment Inc.,Ubisoft Entertainment Inc.,0.0,1.0,Shooter
Without Warning,2005,Action,3rd-person (Other),Xbox,4.9,42% (28),"CE Europe Ltd., Capcom Entertainment, Inc.",CE Europe Ltd.,0.0,1.0,"Puzzle elements, Shooter"
Baseball,1983,Sports,Diagonal-down,NES,4.9,42% (21),"Nintendo Co., Ltd., Nintendo of America Inc., Nintendo of Canada Ltd.","Nintendo Co., Ltd.",0.0,1.0,Baseball
Gravity Games Bike: Street • Vert • Dirt,2002,Sports,Behind view,Xbox,4.9,37% (10),"Midway Games West, Inc.","Midway Games West, Inc.",0.0,1.0,Real-time
Prison Break: The Conspiracy,2010,Action,Behind view,Windows,4.9,42% (35),"Koch Media GmbH (Austria), Deep Silver, Inc.",Koch Media GmbH (Austria),0.0,1.0,"Quick Time Events (QTEs), Stealth"
Dragon Ball Z: Ultimate Battle 22,1995,Action,Side view,PlayStation,4.9,37% (12),"Tose Co., Ltd.","Tose Co., Ltd.",0.0,1.0,2D scrolling
Club & Country,1995,Sports,Managerial / business simulation,DOS,4.9,28% (6),BOMS Computer Games Ltd.,BOMS Computer Games Ltd.,0.0,1.0,Football (European) / Soccer
Locus,1995,Racing / Driving,1st-person,Windows,4.9,39% (9),GT Interactive Software Corp.,GT Interactive Software Corp.,0.0,1.0,Sci-fi / futuristic
Deer Avenger,1998,Action,1st-person,Macintosh,4.9,36% (8),Simon & Schuster Interactive,Simon & Schuster Interactive,0.0,1.0,Hunting
Slot Racers,1978,Action,Top-down,Atari 2600,4.9,32% (4),"Atari, Inc.","Atari, Inc.",0.0,1.0,Fixed / flip-screen
Cyberbykes: Shadow Racer VR,1995,Racing / Driving,1st-person,DOS,4.9,38% (8),"Artificial Software, LLC","Artificial Software, LLC",0.0,1.0,"Motorcycle, Track racing, Vehicle simulator"
Donkey Kong Jr. Math,1983,Educational,Side view,NES,4.9,31% (9),"Nintendo Co., Ltd., Nintendo of America Inc., Nintendo of Europe GmbH","Nintendo Co., Ltd.",0.0,1.0,Fixed / flip-screen
Dead Space: Ignition,2010,Action,3rd-person (Other),Xbox 360,4.9,39% (10),"Electronic Arts, Inc.","Electronic Arts, Inc.",0.0,1.0,"Platform, Puzzle elements"
David Beckham Soccer,2001,Sports,Top-down,Game Boy Advance,4.9,40% (9),"Rage Games Ltd., Majesco Sales, Inc.",Rage Games Ltd.,0.0,1.0,Football (European) / Soccer
Erotic Empire,2004,Strategy,1st-person,Windows,4.9,38% (10),Zone 2 Studios GmbH,Zone 2 Studios GmbH,0.0,1.0,Managerial / business simulation
Target: Terror,2004,Action,1st-person,Arcade,4.9,40% (15),"Raw Thrills, Inc., Konami Digital Entertainment, Inc.","Raw Thrills, Inc.",0.0,1.0,Rail shooter
Iron Man,2008,Action,3rd-person (Other),Xbox 360,4.9,44% (58),"SEGA Europe Ltd., SEGA of America, Inc.",SEGA Europe Ltd.,0.0,1.0,Shooter
Beast Wrestler,1991,Action,Isometric,Genesis,4.9,38% (5),Riot,Riot,0.0,1.0,Fighting
Cover Girl Strip Poker,1991,Strategy,1st-person,DOS,4.9,35% (9),"Emotional Pictures, Sales Curve Ltd., The, On-Line Entertainment Ltd., Storm",Emotional Pictures,0.0,1.0,Cards / tiles
Harlem Globetrotters: World Tour,2006,Action,3rd-person (Other),Game Boy Advance,4.9,28% (8),"Destination Software, Inc., ZOO Digital Publishing Ltd.","Destination Software, Inc.",0.0,1.0,Basketball
Andre Agassi Tennis,1992,Sports,Diagonal-down,Genesis,4.9,46% (13),"TecMagik Entertainment Ltd., Lance Investments, Radiance Software",TecMagik Entertainment Ltd.,0.0,1.0,Tennis
Undercover AD2025 Kei,2000,Action,3rd-person (Other),Dreamcast,4.9,33% (8),"Pulse Interactive, Inc.","Pulse Interactive, Inc.",0.0,1.0,Shooter
The Simpsons Wrestling,2001,Action,3rd-person (Other),PlayStation,4.9,39% (21),"Big Ape Productions, Inc.","Big Ape Productions, Inc.",0.0,1.0,Wrestling
ECW Hardcore Revolution,2000,Sports,3rd-person (Other),Game Boy Color,4.9,28% (7),Crawfish Interactive Ltd.,Crawfish Interactive Ltd.,0.0,1.0,Wrestling
MotionSports,2010,Sports,3rd-person (Other),Xbox 360,4.9,36% (8),Ubisoft Studios SRL,Ubisoft Studios SRL,0.0,1.0,Arcade
Street Cred Football,1989,Action,Top-down,Commodore 64,4.9,37% (4),Players Premier,Players Premier,0.0,1.0,Football (European) / Soccer
Hilfe! Ich bin ein Fisch,2001,Adventure,3rd-person (Other),Windows,4.9,33% (5),FunDragoon Games & Entertainment GmbH,FunDragoon Games & Entertainment GmbH,0.0,1.0,Real-time
Ju-on: The Grudge,2009,Adventure,1st-person,Wii,4.9,36% (10),feelplus Inc.,feelplus Inc.,0.0,1.0,Horror
World War II Combat: Road to Berlin,2006,Action,1st-person,Windows,4.9,24% (6),"Groove Games, 1C Company",Groove Games,0.0,1.0,Shooter
5th Gear,1988,Action,Top-down,Commodore 64,4.9,47% (8),"Hewson Consultants Ltd., Rack-It, Prism Leisure Corporation Plc",Hewson Consultants Ltd.,0.0,1.0,2D scrolling
International Championship Athletics,1991,Sports,3rd-person (Other),Amiga,4.9,39% (10),Hawk,Hawk,0.0,1.0,Olympiad / mixed sports
Baldur's Gate: Enhanced Edition - Siege of Dragons...,2016,DLC / Add-on,Item,Windows,4.9,62% (3),"Beamdog, Overhaul Games",Beamdog,0.0,1.0,
Emergency Mayhem,2008,Action,3rd-person (Other),Wii,4.9,44% (25),Supersonic Software Ltd.,Supersonic Software Ltd.,0.0,1.0,"Arcade, Board game"
The Forgotten: It Begins,1999,Adventure,1st-person,Windows,4.9,43% (9),DreamCatcher Interactive Inc.,DreamCatcher Interactive Inc.,0.0,1.0,Puzzle elements
Streets of SimCity,1997,Action,1st-person,Windows,4.9,46% (13),Maxis Software Inc.,Maxis Software Inc.,0.0,1.0,Shooter
Nerf Legends,2021,Action,1st-person,Xbox One,4.9,27% (5),GameMill Entertainment LLC,GameMill Entertainment LLC,0.0,1.0,Shooter
Western Outlaw: Wanted Dead or Alive,2003,Action,1st-person,Windows,4.9,40% (6),Jarhead Games Inc.,Jarhead Games Inc.,0.0,1.0,Shooter
Dual Heroes,1997,Action,Side view,Nintendo 64,4.9,39% (9),"Produce Co., Ltd.","Produce Co., Ltd.",0.0,1.0,2D scrolling
The Hunt for Red October,1993,Action,Side view,SNES,4.9,32% (7),"RSP, Inc.","RSP, Inc.",0.0,1.0,2D scrolling
Roy of the Rovers,1988,Sports,Side view,Commodore 64,4.9,44% (8),Gremlin Graphics Software Limited,Gremlin Graphics Software Limited,0.0,1.0,Arcade
Predator,1988,Action,Side view,NES,4.9,38% (4),"Pack-In-Video Co., Ltd, Activision, Inc., Gradiente Industrial S.A.","Pack-In-Video Co., Ltd",0.0,1.0,2D scrolling
Disney Infinity: Edition 2.0 - Marvel Super Heroes,2014,Compilation,,Xbox 360,8.3,77% (5),"Disney Interactive Studios, Inc.","Disney Interactive Studios, Inc.",0.0,1.0,
Half-Life 1: Anthology,2005,Compilation,,Windows,8.4,75% (1),,,0.0,1.0,
Pinball FX2: Portal Pinball,2015,DLC / Add-on,1st-person,PlayStation 3,8.6,100% (1),"Zen Stúdió Kft, Microsoft Studios",Zen Stúdió Kft,0.0,1.0,Pinball
Spider-Man: Total Mayhem,2010,Action,Behind view,iPhone,8.4,82% (10),Gameloft S.A.,Gameloft S.A.,0.0,1.0,Beat 'em up / brawler
The Treasures of Montezuma 2,2009,Puzzle,Side view,Windows,8.3,64% (2),"Alawar Entertainment, Inc., Purple Hills, HeroCraft Ltd, Media Sales & Licensing","Alawar Entertainment, Inc.",0.0,1.0,Fixed / flip-screen
Resident Evil: Revelations 2 - Complete Season,2015,Compilation,,Windows,8.3,78% (1),"Capcom Co., Ltd., Capcom U.S.A., Inc.","Capcom Co., Ltd.",0.0,1.0,
Pinball FX2: Marvel Pinball,2010,DLC / Add-on,1st-person,Xbox 360,8.3,75% (2),"Microsoft Studios, Zen Stúdió Kft",Microsoft Studios,0.0,1.0,Pinball
Call of Duty 4: Modern Warfare (Limited Collector'...,2007,Special edition,Digital extras,Windows,8.6,90% (1),"Activision Publishing, Inc., Noviy Disk","Activision Publishing, Inc.",0.0,1.0,
Pinball FX2: Doctor Strange,2013,DLC / Add-on,1st-person,PlayStation 3,8.5,(12),"Zen Stúdió Kft, Microsoft Studios",Zen Stúdió Kft,0.0,1.0,Pinball
Marvel Pinball: Vengeance and Virtue,2011,DLC / Add-on,1st-person,PlayStation 3,8.6,89% (1),"Zen Stúdió Kft, Microsoft Studios",Zen Stúdió Kft,0.0,1.0,Pinball
Sleeping Dogs: Definitive Edition,2014,Action,Behind view,Windows,8.0,77% (14),"Square Enix, Inc., Square Enix Co., Ltd.","Square Enix, Inc.",0.0,1.0,"Beat 'em up / brawler, Sandbox / open world, Shooter"
Pinball FX2: Captain America,2011,DLC / Add-on,1st-person,Xbox 360,8.4,(11),"Microsoft Studios, Zen Stúdió Kft",Microsoft Studios,0.0,1.0,Pinball
The Witcher 3: Wild Hunt - Blood and Wine,2016,DLC / Add-on,Item,Windows,8.8,92% (12),CD Projekt S.A.,CD Projekt S.A.,0.0,1.0,
Baldur's Gate (Gold Edition),1998,Special edition,,Windows,8.4,98% (1),,,0.0,1.0,
StarCraft II: Wings of Liberty (Collector's Editio...,2010,Special edition,Digital extras,Windows,8.4,(12),Blizzard Entertainment Inc.,Blizzard Entertainment Inc.,0.0,1.0,
Fahrenheit: Indigo Prophecy - Remastered,2015,Action,1st-person,iPhone,7.8,69% (13),"Aspyr Media, Inc.","Aspyr Media, Inc.",0.0,1.0,Sci-fi / futuristic
StarCraft: Anthology,1999,Compilation,,Windows,8.5,(16),Blizzard Entertainment Inc.,Blizzard Entertainment Inc.,0.0,1.0,
Wajas,2006,Simulation,Persistent,Browser,8.7,(21),"Wajas, Inc","Wajas, Inc",0.0,1.0,Life / social simulation
The Witcher 3: Wild Hunt - Hearts of Stone,2015,DLC / Add-on,Item,Windows,8.7,90% (13),CD Projekt S.A.,CD Projekt S.A.,0.0,1.0,
Uncharted: The Nathan Drake Collection,2015,Action,Behind view,PlayStation 4,8.3,84% (8),"Naughty Dog, Inc.","Naughty Dog, Inc.",0.0,1.0,"Puzzle elements, Shooter, Stealth"
Resident Evil: Revelations 2 - Extra Episode 2: Li...,2015,Action,Behind view,Windows,8.3,(12),"Capcom Co., Ltd., Capcom U.S.A., Inc.","Capcom Co., Ltd.",0.0,1.0,"Stealth, Survival horror"
Shanghai: Triple-Threat,1994,Puzzle,Top-down,Sharp X68000,8.2,79% (5),"Electronic Arts Victor, Activision, Inc., Sony Computer Entertainment Inc.",Electronic Arts Victor,0.0,1.0,Turn-based
Far Cry 2 (Collector's Edition),2008,Special edition,Physical extras,Xbox 360,8.4,(14),Ubisoft Entertainment SA,Ubisoft Entertainment SA,0.0,1.0,
Resident Evil: Revelations 2 - Episode 2: Contempl...,2015,Action,Behind view,Windows,8.2,76% (4),"Capcom Co., Ltd., Capcom U.S.A., Inc.","Capcom Co., Ltd.",0.0,1.0,"Shooter, Survival horror"
Resident Evil: Revelations 2 - Extra Episode 1: T...,2015,Action,Behind view,Windows,8.3,(12),"Capcom Co., Ltd., Capcom U.S.A., Inc.","Capcom Co., Ltd.",0.0,1.0,"Shooter, Survival horror"
Skylanders: Trap Team,2014,Action,Behind view,Android,8.2,82% (13),"Activision Publishing, Inc.","Activision Publishing, Inc.",0.0,1.0,Fantasy
Skylanders: Spyro's Adventure,2011,Action,3rd-person (Other),PlayStation 3,8.0,78% (24),"Activision Publishing, Inc.","Activision Publishing, Inc.",0.0,1.0,Fantasy
The Simpsons Cartoon Studio,1996,Educational,Graphics / art,Windows,8.0,72% (4),"Fox Interactive, Inc.","Fox Interactive, Inc.",0.0,1.0,Licensed
Resident Evil: Revelations 2 - Episode One: Penal ...,2015,Action,Behind view,Windows,7.8,75% (17),"Capcom Co., Ltd., Capcom U.S.A., Inc.","Capcom Co., Ltd.",0.0,1.0,"Shooter, Survival horror"
Batman: Arkham City (Collector's Edition),2011,Special edition,Digital extras,Xbox 360,7.9,50% (1),Warner Bros. Interactive Entertainment Inc.,Warner Bros. Interactive Entertainment Inc.,0.0,1.0,
Batman: Arkham City - Game of the Year Edition,2012,Special edition,Digital extras,Windows,8.6,(20),"Warner Bros. Interactive Entertainment Inc., Feral Interactive Ltd.",Warner Bros. Interactive Entertainment Inc.,0.0,1.0,
Penumbra Collection,2008,Compilation,,Windows,7.9,70% (3),"1C Company, Snowball Studios, Paradox Interactive AB, Frictional Games AB",1C Company,0.0,1.0,
Prince of Persia Trilogy,2005,Compilation,,Windows,8.2,82% (6),"Ubisoft Entertainment SA, Akella, ak tronic Software & Services GmbH",Ubisoft Entertainment SA,0.0,1.0,
World of WarCraft: Wrath of the Lich King (Collect...,2008,Special edition,Extra content / game,Windows,8.2,(10),"Soft Club, Blizzard Entertainment Europe, Blizzard Entertainment Inc.",Soft Club,0.0,1.0,
Uncharted 4: A Thief's End,2016,Action,Behind view,PlayStation 4,9.1,93% (33),"Naughty Dog, Inc.","Naughty Dog, Inc.",0.0,1.0,"Puzzle elements, Shooter, Stealth"
BioShock 2 (Rapture Edition),2010,Special edition,Physical extras,Windows,8.3,(13),"2K Games, Inc.","2K Games, Inc.",0.0,1.0,
Resident Evil: Revelations 2 - Episode 3: Judgment,2015,Action,Behind view,Windows,8.1,50% (1),"Capcom Co., Ltd., Capcom U.S.A., Inc.","Capcom Co., Ltd.",0.0,1.0,"Shooter, Survival horror"
Resident Evil: Revelations 2,2015,Compilation,,Windows,8.0,76% (30),"Capcom Co., Ltd., Capcom U.S.A., Inc., CE Europe Ltd., ak tronic Software & Services GmbH","Capcom Co., Ltd.",0.0,1.0,
Resident Evil: Revelations 2 - Episode 4: Metamorp...,2015,DLC / Add-on,Item,Windows,8.0,50% (1),"Capcom Co., Ltd., Capcom U.S.A., Inc.","Capcom Co., Ltd.",0.0,1.0,
Injustice 2,2017,Action,Side view,PlayStation 4,8.4,85% (40),Warner Bros. Interactive Entertainment Inc.,Warner Bros. Interactive Entertainment Inc.,0.0,1.0,2D scrolling
Just Dance 2018,2017,Action,3rd-person (Other),Xbox 360,7.5,72% (20),"Ubisoft, Inc., Ubisoft Entertainment SA","Ubisoft, Inc.",0.0,1.0,Music / rhythm
A Dark Room,2013,Simulation,Text-based / Spreadsheet,Browser,8.1,80% (3),"Doublespeak Games, Dragon Studio, ZenithMoon Studios, CIRCLE Entertainment Ltd.",Doublespeak Games,0.0,1.0,Fixed / flip-screen
Metroid Prime Trilogy,2009,Action,1st-person,Wii,8.8,90% (20),"Nintendo of America Inc., Nintendo of Europe GmbH",Nintendo of America Inc.,0.0,1.0,Shooter
Life Is Strange: Limited Edition,2016,Compilation,Digital extras,PlayStation 4,8.4,85% (1),"Square Enix, Inc., Square Enix Limited","Square Enix, Inc.",0.0,1.0,
Life Is Strange: Season Pass - Episodes 2-5,2015,Compilation,Story / mission,Windows,8.5,85% (1),"Square Enix Co., Ltd.","Square Enix Co., Ltd.",0.0,1.0,
Pinball FX2: Marvel Pinball - Avengers Chronicles,2012,DLC / Add-on,1st-person,PlayStation 3,8.2,(11),"Zen Stúdió Kft, Microsoft Studios",Zen Stúdió Kft,0.0,1.0,Pinball
Mortal Kombat: Komplete Edition,2012,Action,3rd-person (Other),Xbox 360,8.5,88% (9),Warner Bros. Interactive Entertainment Inc.,Warner Bros. Interactive Entertainment Inc.,0.0,1.0,Fighting
The Star Wars Trilogy,1989,Compilation,,Amiga,8.0,77% (3),Domark Limited,Domark Limited,0.0,1.0,
Life Is Strange: Episode 3 - Chaos Theory,2015,DLC / Add-on,Story / mission,Xbox 360,8.4,88% (2),"Square Enix Co., Ltd., Square Enix, Inc.","Square Enix Co., Ltd.",0.0,1.0,
Pinball FX2: Deadpool,2014,DLC / Add-on,Map / level,PlayStation 3,8.5,(23),"Zen Stúdió Kft, Microsoft Studios",Zen Stúdió Kft,0.0,1.0,Licensed
Life Is Strange: Episode 2 - Out of Time,2015,DLC / Add-on,Story / mission,Xbox 360,8.3,83% (3),"Square Enix Co., Ltd., Square Enix, Inc.","Square Enix Co., Ltd.",0.0,1.0,
World of WarCraft: The Burning Crusade (Collector'...,2007,Special edition,Extra content / game,Windows,8.3,(14),Blizzard Entertainment Inc.,Blizzard Entertainment Inc.,0.0,1.0,
Arrow of Death Part II,1982,Adventure,1st-person,Atari 8-bit,8.3,60% (1),"Molimerx Ltd., Digital Fantasia Ltd., Channel 8 Software, Acorn Software Products, Inc.",Molimerx Ltd.,0.0,1.0,Fixed / flip-screen
Angry Birds Trilogy,2012,Compilation,Side view,Xbox 360,7.4,67% (13),"Activision Publishing, Inc., Rovio Entertainment Oy","Activision Publishing, Inc.",0.0,1.0,2D scrolling
Baldur's Gate: 4 in 1 Boxset,2006,Compilation,,Windows,8.3,93% (1),,,0.0,1.0,
StarCraft II: Legacy of the Void,2015,DLC / Add-on,Map / level,Windows,8.5,86% (14),Blizzard Entertainment Inc.,Blizzard Entertainment Inc.,0.0,1.0,
DoDonPachi,1997,Action,Top-down,Arcade,8.0,67% (1),"Atlus Co., Ltd., SPS, HAMSTER Corporation","Atlus Co., Ltd.",0.0,1.0,2D scrolling
Life Is Strange: Episode 4 - Dark Room,2015,DLC / Add-on,Story / mission,Xbox 360,8.2,85% (1),"Square Enix Co., Ltd., Square Enix, Inc.","Square Enix Co., Ltd.",0.0,1.0,
Guacamelee!: Super Turbo Championship Edition,2014,Action,Side view,PlayStation 4,8.6,88% (20),DrinkBox Studios Inc.,DrinkBox Studios Inc.,0.0,1.0,2D scrolling
Life Is Strange: Episode 5 - Polarized,2015,DLC / Add-on,Story / mission,Xbox 360,8.3,86% (2),"Square Enix Co., Ltd., Square Enix Limited, Square Enix, Inc.","Square Enix Co., Ltd.",0.0,1.0,
Osu! Tatakae! Ouendan,2005,Action,Music / rhythm,Nintendo DS,8.7,89% (26),iNiS corporation,iNiS corporation,0.0,1.0,
Pinball FX2: Star Wars Pinball,2013,Action,1st-person,Xbox 360,8.0,77% (3),"Zen Stúdió Kft, Microsoft Studios",Zen Stúdió Kft,0.0,1.0,Pinball
SimCity 2000: CD Collection,1994,Compilation,Extra content / game,DOS,8.3,81% (4),"Maxis Software Inc., Virgin Interactive Entertainment SARL, Electronic Arts, Inc., Tandem Verlag GmbH",Maxis Software Inc.,0.0,1.0,
Battlefield 1942: Deluxe Edition,2003,Compilation,,Windows,8.2,84% (8),"Electronic Arts, Inc., Aspyr Media, Inc.","Electronic Arts, Inc.",0.0,1.0,
LEGO Marvel Avengers,2016,Action,3rd-person (Other),Windows,7.5,71% (13),"Warner Bros. Interactive Entertainment Inc., Feral Interactive Ltd., ak tronic Software & Services GmbH",Warner Bros. Interactive Entertainment Inc.,0.0,1.0,"Platform, Puzzle elements, Sandbox / open world"
NBA 2K10,2009,Sports,Diagonal-down,PlayStation 2,8.2,82% (31),"2K Games, Inc., 1C Company","2K Games, Inc.",0.0,1.0,2D scrolling
Fatal Frame III: The Tormented,2005,Action,1st-person,PlayStation 2,8.2,82% (19),"Tecmo, Ltd., Tecmo, Inc., Take-Two Interactive Software Europe Ltd., Sony Computer Entertainment America LLC","Tecmo, Ltd.",0.0,1.0,Cinematic camera
Metal Slug: Anthology,2006,Action,Side view,Wii,8.0,77% (59),"SNK Playmore USA Corp., Ignition Entertainment Ltd., SNK Playmore Corporation",SNK Playmore USA Corp.,0.0,1.0,Shooter
Tanglewood,2018,Action,Side view,Windows,8.1,80% (24),"Big Evil Corporation Ltd., Mega Cat Studios",Big Evil Corporation Ltd.,0.0,1.0,2D scrolling
Daleks,1985,Strategy,Top-down,DOS,8.3,(20),Bloom County Software,Bloom County Software,0.0,1.0,Turn-based
Until Dawn,2015,Adventure,3rd-person (Other),PlayStation 4,8.1,81% (15),Supermassive Games Ltd.,Supermassive Games Ltd.,0.0,1.0,Cinematic camera
Dragon Ball Z: Burst Limit,2008,Action,Side view,Xbox 360,7.2,70% (61),"Namco Bandai Games Inc., Namco Bandai Games Europe SAS, Atari, Inc., ak tronic Software & Services GmbH",Namco Bandai Games Inc.,0.0,1.0,2D scrolling
Rise of the Tomb Raider,2015,Action,Behind view,Xbox 360,8.5,85% (36),"Microsoft Studios, Microsoft Corporation, Digital Domain Inc.",Microsoft Studios,0.0,1.0,"Platform, Puzzle elements, Shooter"
Super Stardust,1994,Action,Behind view,Amiga,7.7,76% (25),"Team17 Software Limited, GameTek, Inc., GameTek UK Ltd.",Team17 Software Limited,0.0,1.0,Fixed / flip-screen
Summer Carnival '92: Recca,1992,Action,Top-down,NES,8.3,95% (3),"Naxat Soft, Kaga Electronics",Naxat Soft,0.0,1.0,"Arcade, Shooter"
Tactics Ogre,1995,Role-playing (RPG),Diagonal-down,SNES,8.6,85% (11),"Quest Corporation, Riverhill Soft Inc., Artdink Corporation",Quest Corporation,0.0,1.0,Isometric
Ninja Gaiden,1992,Action,Side view,SEGA Master System,8.2,83% (13),"SIMS Co., Ltd.","SIMS Co., Ltd.",0.0,1.0,2D scrolling
Half-Life 2: Game of the Year Edition,2005,Compilation,,Windows,8.3,93% (1),,,0.0,1.0,
Command & Conquer: Generals - Deluxe Edition,2003,Compilation,,Windows,8.2,87% (2),"Electronic Arts, Inc., Aspyr Media, Inc.","Electronic Arts, Inc.",0.0,1.0,
The Last of Us: Part II,2020,Action,Behind view,PlayStation 4,8.8,90% (30),"Sony Interactive Entertainment Europe Ltd., Sony Interactive Entertainment Inc., Sony Interactive Entertainment America LLC, SCE Worldwide Studios",Sony Interactive Entertainment Europe Ltd.,0.0,1.0,"Quick Time Events (QTEs), RPG elements, Stealth"
Crystal Defenders,2008,Strategy,Top-down,iPod Classic,7.1,60% (21),"Square Enix Co., Ltd., Square Enix, Inc., Namco Networks America Inc., Namco Bandai Games America Inc.","Square Enix Co., Ltd.",0.0,1.0,Fixed / flip-screen
Command & Conquer + The Covert Operations,1996,Compilation,,DOS,8.2,80% (1),"Virgin Interactive Entertainment (Europe) Ltd., Westwood Studios, Inc.",Virgin Interactive Entertainment (Europe) Ltd.,0.0,1.0,
Wolfenstein 3D,1994,Action,1st-person,Macintosh,7.6,68% (9),"MacPlay, Interplay Productions, Inc., Electronic Arts Victor, Logicware, Inc.",MacPlay,0.0,1.0,Shooter
Battlefield 3 (Limited Edition),2011,Special edition,Extra content / game,Windows,8.0,(10),"Electronic Arts, Inc.","Electronic Arts, Inc.",0.0,1.0,
Super Mario All-Stars + Super Mario World,1994,Compilation,,SNES,8.5,88% (2),"Nintendo Co., Ltd.","Nintendo Co., Ltd.",0.0,1.0,
Diablo III: Reaper of Souls,2014,DLC / Add-on,Game mode,Windows,8.3,84% (22),"1C-SoftClub, Blizzard Entertainment Inc.",1C-SoftClub,0.0,1.0,
